content,question,answer
"Nation's Museums and Libraries Feed Minds and Bodies this Summer  Libraries remain a part of the fiber of American communities, with over 123,000 operating across the nation.  And in states like Idaho, libraries provided children with more than just books!  For the second straight year, the Idaho Commission for Libraries teamed up with AmeriCorps VISTAs and local summer meal sites to offer “Literacy in the Park”, a program to bring fun educational activities to existing Summer Food Service Program meal sites. They say “If it’s not broke, don’t fix it”!  But “Literacy in the Park” proved that you can certainly add to it!  Julie Armstrong from the Commission for Libraries said, “We thought, if kids are already at the parks eating, let’s offer them literacy activities along with those meals.”  Ten AmeriCorps VISTA volunteers from the Idaho Foodbank assisted with literacy programs at different Boise sites, each sponsored by the Idaho Foodbank and the Oasis Food Center.  Tony Craddock, Jr., Program Analyst, USDA Food and Nutrition Service  Posted in  Food and Nutrition  Sep 26,   Respond to this story",What innovative approach did the Idaho Commission for Libraries take by teaming up with AmeriCorps VISTAs and local summer meal sites to provide literacy activities to children?,"The Idaho Commission for Libraries took an innovative approach by offering ""Literacy in the Park"", a program that brought fun educational activities to existing Summer Food Service Program meal sites, allowing kids to engage in literacy activities while already at the parks eating meals."
"NRCS Oregon in  Conservation  Jun 29,  Beth Hoinacki shows an aspect of her crop rotation and cover crop plan.  U.S. trends in organic farming point to a growing industry. USDA agencies like the Natural Resources Conservation Service (NRCS) support organic growers by offering funding and technical guidance—both to farmers already growing organic crops, and to those who want to transition to organic production. Luckily for Beth Hoinacki, she heard about NRCS’ Organic Initiative right around the same time that she was pursuing organic certification for her operation, Goodfoot Farm. Hoinacki and her husband, Adam Ryan, purchased 10 acres of land situated along the bank of the Luckiamute River in Kings Valley, Ore. in, which they later named “Goodfoot Farm.” They were interested in the Organic Initiative because it helps producers create a conservation plan and apply approved methods targeting specific concerns on their operation. NRCS District Conservationist Tom Snyder and Hoinacki look through her fence to the recently completed grass waterway and hedgerow funded by NRCS’ EQIP Organic Initiative.  Hoinacki credits the Initiative with helping them start projects critical to soil and water quality that they otherwise wouldn’t have been able to address on the farm, where they grow a variety of produce, including blueberries, onions, garlic, potatoes and winter squash. One project helped the couple install a grassed waterway to reduce erosion in order to minimize sediment runoff into the river and improve habitat for threatened and endangered fish. In addition, they’ve planted a hedgerow for pollinator habitat, pursued a waste management plan to protect water quality and developed crop rotation and installed cover crops to improve soil health. Two curly-feathered Sebastopol and two American lavender geese help control grass and weeds on Goodfoot Farm. Hoinacki says that they’ve recently been interested in biodynamic agriculture ­because it takes a more holistic approach to farming. She says that organic methods focus primarily on allowed off-farm inputs on crops or fields, whereas the biodynamic approach is more about creating a plan and purpose for a farm to realize its potential as a natural, self-sustaining system. Hoinacki’s goal is to have a natural system that reduces the need for pest and fertility products to be imported from off the farm. She says that the biodynamic method has influenced her thinking in designing the farm, and NRCS’ Organic Initiative allows her the flexibility to pursue her goals by supporting beneficial plant life for habitat and developing a natural ecosystem within the production system. A nearly-completed culvert in Beth Hoinacki’s grass waterway, engineered by NRCS.  The future of Goodfoot Farm tastes profitable as U.S. organic fruit and vegetable sales continue to grow. And Hoinacki and Ryan will continue to strive to be good stewards of the land. Learn more about NRCS’s Organic Initiative. Follow NRCS on Twitter. Check out other conservation-related stories on the USDA blog  Category/Topic:  Conservation  Tags:  Conservation  Natural Resources Conservation Service  NRCS  Oregon  organic initiative",What key difference does Beth Hoinacki identify between traditional organic methods and biodynamic agriculture in terms of their approach to farming?,"Beth Hoinacki identifies that traditional organic methods focus primarily on allowed off-farm inputs, whereas biodynamic agriculture takes a more holistic approach, focusing on creating a plan and purpose for the farm to realize its potential as a natural, self-sustaining system."
"USDA APHIS Public Affairs Specialist in  Animals  Plants  Apr 04,  Invasive feral swine have spread rapidly across the United States as a result of natural range expansion, illegal trapping and movement by people, and escapes from domestic swine operations and hunting preserves. Wild boar, razorback, feral hog, wild pig — these are just some of the names we attribute to one of the most destructive and formidable invasive species in the United States. Feral swine adapt to just about any habitat, have few natural enemies, and reproduce at high rates. As such, their population is growing rapidly nationwide. At 5 million animals and counting, feral swine are now found in at least 39 States and cause approximately $1.5 billion in damages and control costs each year. Their damage is diverse and includes destroying native habitats and crops, eating endangered species, and spreading disease. Natural resource managers, researchers and academics nationwide are grappling with how best to address the challenges of feral swine management. Feral swine are hunted by the public in some States for recreational purposes; but hunting will not solve our country’s feral swine problems. “Feral swine don’t know boundaries and what happens in one State affects neighboring States,” states APHIS’ new national feral swine initiative coordinator Dr. Dale Nolte. “Only through a concerted, comprehensive effort with the public and our State and Federal partners can we begin to turn the tide on feral swine expansion and reduce their negative impacts to our economy and environment.” The USDA and it partners hope to accomplish just that. In , APHIS Wildlife Services received $20 million from Congress to begin a collaborative, national feral swine management initiative with APHIS Veterinary Services and International Services, as well as numerous local, State, and Federal partners.  The goal of the initiative is to prevent the further spread of feral swine, as well as reduce their population, damage, and associated disease risks.  Though management efforts will occur in many different locations and habitats throughout the United States, these actions will be modified and adapted to best meet the needs and objectives of each State.  The initiative will be highlighted at the International Wild Pig Conference in Montgomery, Alabama, on April 14-16. For more information, please visit the APHIS feral swine web page. April is Invasive Plant, Pest, and Disease Awareness Month.  Learn more about APHIS Wildlife Services activities related to invasive wildlife.  Category/Topic:  Animals  Plants  Tags:  Alabama  APHIS  Dale Nolte  feral swine  wildlife damage  Wildlife Services","What are the primary challenges associated with managing feral swine populations in the United States, and what approach do experts recommend to address these issues?","The primary challenges associated with managing feral swine populations in the United States are their rapid population growth, widespread distribution across 39 states, and diverse damage including habitat destruction, crop loss, and disease transmission. Experts recommend a concerted, comprehensive effort involving the public, state, and federal partners to prevent further spread, reduce population, and mitigate negative impacts on the economy and environment."
"Food Driver Coordinator, Human Resources Department, USDA Food and Nutrition Service, Southwest Regional Office in  Food and Nutrition  Sep 28,  Lupe Gomez, Coordinator and WIC staff show their contributions to the food drive. This summer I had the honor of organizing the Feds, Farmers and Friends Feed Families Food Drive for the Southwest Region Food and Nutrition Service.  As the human resources liaison for the region, I don’t get the opportunity to work directly with partners or clients so this food drive gave me a very unique perspective on hunger.  I collected food items, sent out reminders to staff and ensured delivery of the food to the North Texas Food Bank. The Feds, Farmers, and Friends Feed Families program was USDA's contribution to the federal government-wide effort Feds Feed Families, led by the Office of Personnel Management. From June through September , USDA employees, farmers, and friends joined together to combat hunger and help children and families in need. This year's goal was to collect 1.2 million pounds of food from federal offices nationwide. I am proud to report that the Southwest Regional Office (SWR) Food and Nutrition Service (FNS) staff donated 518 pounds of non-perishable food during the months of July and August.  We kept track of the donations by program area throughout the drive.  I am happy to report that the SWR Special Supplemental Nutrition Program for Women, Infants and Children staff surpassed the donations made by all other program areas.  We have wrapped up our food drive for the summer and it has been a positive experience for everyone involved, especially FNS staff who had the opportunity to show who much they care about the community we serve – either on the job or through our volunteer efforts. More information about the Feds Feed Families campaign visit our website.  Category/Topic:  Food and Nutrition  Tags:  Feds Farmers and Friends Feed Families  FNS  Infants and Children  Southwest Regional Office  Special Supplemental Nutrition Program for Women  USDA","What was the total amount of non-perishable food donated by the Southwest Regional Office (SWR) Food and Nutrition Service (FNS) staff during the Feds, Farmers, and Friends Feed Families Food Drive?",518 pounds.
"Fresh from the Garden  I get to learn about a lot of great local initiatives when I make visits around the country.  On a recent trip to Dallas, I visited Metrocrest Social Services, a community resource agency in Farmers Branch, Texas, that provides services to families in crisis and helps them make plans for the future. The purpose of the visit was to learn how outreach workers from the North Texas Food Bank come to this office to assist clients submit applications for the Supplemental Nutrition Assistance Program. Camilla Zimbal, social services director, gave me a tour of the agency, and showed me some of the other services available to clients. One of the highlights of this one-stop shop is a food pantry at which pantry clients may select groceries once a week. In addition to the canned and boxed food, they can also select fresh-from-the-garden fruit and vegetables.  Audrey Rowe, USDA Food and Nutrition Service, Administrator  Posted in  Food and Nutrition  Apr 18,   1 Response",What types of groceries are pantry clients at Metrocrest Social Services able to select from their weekly food supply?,"Pantry clients at Metrocrest Social Services can select canned goods, boxed food, fresh-from-the-garden fruit and vegetables."
"The US Forest Service and International Day of Forests  Since , the United Nations (UN) has selected March 21 to be the unique day that the world thinks about the importance of trees. The U.S. Forest Service celebrates the International Day of Forests by bringing awareness about our involvement with international partners to continue to protect the health of forest worldwide. For instance in the Middle Eastern and Mediterranean country of Lebanon, the power of one symbolic cedar tree, the image on the country’s flag, captures the promise and strength of an entire nation.  Aysha Ghadiali, U.S. Forest Service, International Programs  Posted in  Forestry  Mar 20,   Respond to this story",What specific initiatives or projects is the US Forest Service undertaking with international partners to protect forest health on the designated International Day of Forests?,"There is no specific information provided about the US Forest Service's initiatives or projects undertaken with international partners to protect forest health. The content only mentions that they celebrate the International Day of Forests by bringing awareness about their involvement with international partners, but does not provide any further details."
"Renewable Energy Opportunities Discussed at Agriculture Outlook Forum  Speaking before a capacity crowd this morning at the USDA Agricultural Outlook Forum, a distinguished panel representing three federal agencies and a member of the agricultural media discussed Federal renewable energy policy and its prospects to reduce consumption of imported oil, improve environmental quality and produce new jobs in rural America.  Wayne Maloney, USDA Office of Communications  Posted in  Energy  Feb 25,   2 Responses","What are the potential policy prospects for renewable energy development in rural America, as discussed at the Agriculture Outlook Forum?","Reducing consumption of imported oil, improving environmental quality, and producing new jobs in rural America."
"Deputy Administrator of the AMS Livestock, Poultry, and Seed Program in  Food and Nutrition  Sep 13,  AMS verifies cage-free claims for shell eggs by visiting the farms twice each year to ensure that the eggs are in fact coming from a cage-free flock. (Click to view a larger version) When it comes to purchasing eggs, consumers have interests that go well beyond what they see in the carton.  For many buyers, where that egg came from and how it was produced are just as important as the finished product.  Organic, locally produced, cage-free, and free range are just a few of the marketing claims consumers will find on the carton, as producers try to communicate the attributes of their product.  To provide additional assurance to their customers of the validity of marketing claims, shell egg producers often enlist the services of USDA’s Agricultural Marketing Service (AMS). In recent months, a long list of large volume food buyers – including restaurants, grocers, distributors and more – have announced they will transition to sourcing eggs and egg products only from cage-free production systems.  You can learn more about this trend in a recent USDA Blog post.  Many shell egg suppliers have already found a way to assure customers that products marketed as cage-free are indeed sourced from such systems: when USDA Graded eggs are also identified as cage-free, they must undergo a review process to verify the claim is truthful. Through its Livestock, Poultry, and Seed Program, AMS provides shell egg quality grading and certification services to businesses on a voluntary, fee-for-service basis.  Egg cartons bearing the USDA Grade Shield – usually either “USDA Grade AA” or “USDA Grade A” – must meet strict U.S. quality standards.  In addition to verifying that eggs meet the stated grade, USDA’s highly-trained graders inspect processing facilities for proper sanitation and refrigeration, and verify proper identification and traceability methods such as code dating and plant numbers.  Further, packaging materials that bear a USDA Grade Shield must be pre-approved by USDA to ensure the labeling is truthful and not misleading.  This includes claims regarding the method of production (cage-free, free range, etc.), making the USDA Grade Shield a symbol of quality and integrity. Not all USDA graded eggs are cage-free, and not all cage-free eggs are graded by USDA.  But, eggs packed under a USDA Grade Shield and marketed as cage-free – or with any other production claim – must be source-verified by USDA through onsite farm visits, at least twice annually, to check that the laying hens are housed in the appropriate production system.  For AMS approval, cage-free eggs must be produced by hens housed in a way that allows for not only unlimited access to food and water, but, unlike eggs from caged hens, also provides them the freedom to roam during the laying cycle. We also know some consumers prefer their eggs to come from “free range” hens.  For those eggs, we verify they are produced by hens that are not only housed in a way that allows for unlimited access to food and water and provides the freedom to roam within the area like cage-free hens but also gives the hens continuous access to the outdoors during their laying cycle. At the processing facility, it’s not uncommon for cage-free eggs to be received alongside literally millions of non-cage-free eggs.  So, AMS requires a written and implemented segregation and traceability plan detailing how the company maintains the identity of the eggs from production through storage, transport, processing, and packaging.  Then, during packing, AMS verifies that only eggs sourced from the appropriate flocks are packaged into cartons bearing a USDA Grade Shield. Whether you are an agricultural business wanting to differentiate your product in the marketplace or a consumer looking for quality eggs, AMS grading and certification services ensure that quality and marketing claims are verified from farm to table.  Category/Topic:  Food and Nutrition  Tags:  AMS  cage-free  Eggs  Free Range  Grade A  Grade AA  grade shield  grade standards  grading  organic  pasture-raised  raised without antibiotics","What must USDA verify through onsite farm visits, at least twice annually, for egg cartons bearing the USDA Grade Shield and marketed as cage-free?","USDA must verify that eggs being packed under a USDA Grade Shield and marketed as cage-free are indeed produced by hens housed in a way that allows for not only unlimited access to food and water, but also provides them the freedom to roam during the laying cycle."
"Conservation  Research and Science  Jun 14,   Rural Development Public Affairs Director On June 8, , Ohio State Rural Development Director Tony Logan joined other funding partners and representatives from The Wilds for a ribbon cutting ceremony, celebrating the official opening of the Conservation Science Training Center (CSTC). Rural Development awarded $30,000 from its Community Facilities Grant Program to help fund the facility’s construction. The CSTC is a 3,600 square foot facility built to further the Wilds’ conservation and educational mission. The CSTC will provide meeting, classroom, laboratory space and cabins to be used for extended stays by national and international visiting research teams. Constructed directly into a natural hillside, the facility incorporates geothermal heating and cooling, natural lighting, and other green-identified technologies. Nestled on nearly 10,000 acres dedicated to conservation research and education, the Wilds’ current research activities include: prairie biomass and carbon sequestration initiatives, grassland bird research and biodiversity surveys, prairie restoration and more. Bringing the CSTC on line will expand the ability of The Wilds to provide additional support and opportunities for professors, teachers, students and visitors to investigate the ecological systems and wildlife health in Ohio’s Appalachian region. Funding partners included: the USDA Rural Development, American Electric Power Foundation, the Appalachian Regional Commission, Governor’s Office of Appalachia and Hocking College. From left to right: Dr. Roy Palmer, Senior Vice President, Hocking College; Tony Logan, State Director, USDA Rural Development; Dr. Evan Blumer, Executive Director, The Wilds; Robert Powers, President, AEP Utilities; Fred Deel, Director, Governor’s Office of Appalachia.  Category/Topic:  Conservation  Research and Science  Tags:  Appalachia  Conservation  CSTC  Grants  Ohio  Rural Development  The Wilds","What new facility will expand the conservation and educational mission of The Wilds, a conservation research and education center located in Ohio's Appalachian region?",The new facility is the Conservation Science Training Center (CSTC).
"Farm Internet Access on the Rise, Now Let’s Connect This post is part of the Science Tuesday feature series on the USDA blog. Check back each week as we showcase stories and news from the USDA’s rich science and research portfolio. It’s no secret that the landscape of rural America and the ways in which farmers and ranchers do business is evolving. These changes are happening not only in the fields, in terms of what is produced and how, but also in the office and home with how producers access information and conduct business.  Dr. Cynthia Clark, USDA/NASS Administrator  Posted in  Research and Science  Aug 16,   Respond to this story",What progress has been made in providing internet access to rural areas where farmers and ranchers operate their businesses?,There is progress being made in providing internet access to rural areas where farmers and ranchers operate their businesses.
"Pooling Resources for Scientific Breakthroughs  American farmers know about planting seeds—both in the ground and in groundbreaking research. While the seeds they plant as individual farmers feed and clothe the rest of us, the seeds they sow collectively through participation in research and promotion (R&P) programs are vitally important, too. Funded entirely by industry, agricultural R&P programs are a way for producers and businesses across a commodity industry to pool their resources to help market and improve their products. With oversight provided by USDA’s Agricultural Marketing Service (AMS), one of the most important seeds these programs sow is the foundational research that paves the way for breakthroughs that once seemed unimaginable.  Craig A. Morris, Deputy Administrator of the AMS Livestock, Poultry and Seed Program  Posted in  Conservation  Apr 30, 2014  Respond to this story","What are some examples of ""breakthroughs unimaginable"" that have been made possible by foundational research supported by agricultural programs and the USDA's Agricultural Marketing Service (AMS)?",No specific examples are provided in the content.
"Farm to School Champions Needed! Apply for a Grant Today  October is more than a time for crisp temperatures and vibrant autumn leaves. It’s also Farm to School Month, when USDA joins schools, farms, and community organizations across the country to celebrate the role of farm to school programs in getting healthy, locally grown foods onto children’s trays through child nutrition programs, including school breakfast and lunch.  Tony Craddock, Jr., Public Affairs Specialist, Food and Nutrition Service  Posted in  Food and Nutrition  Nutrition Security  Oct 20,   Respond to this story",What is the primary goal of Farm to School programs in conjunction with child nutrition programs like school breakfast and lunch?,"The primary goal of Farm to School programs in conjunction with child nutrition programs like school breakfast and lunch is to get healthy, locally grown foods onto children's trays."
