content,question,answer
"-Missick, USDA-Agricultural Research Service Information Staff in  Research and Science  Dec 03,  Bridalveil Falls, Yosemite National Park, California (USDA-NRCS photo by Ron Nichols). This post is part of the Science Tuesday feature series on the USDA blog. Check back each week as we showcase stories and news from USDA's rich science and research portfolio. An award-winning watershed assessment tool, the Automated Geospatial Watershed Assessment (AGWA), was deployed to assess potential Rim Fire threats in Yosemite National Park in California.  The park experienced a devastating fire that began on August 17, , and took several months to contain. The fire burned more than 400 square miles in and around the park, cost $125.8 million to date, and is considered one of the largest wildfires in California’s history. BAER (Burned Area Emergency Response) is a multi-agency group that includes USDA’s Forest Service and others, and is responsible for identifying potential threats such as downstream flooding and developing plans to rehabilitate and restore burned areas. BAER teams use AGWA to target immediate efforts to prevent threats to people, wildlife and the land.  Using AGWA combined with the burn severity map produced by BAER teams, experts can rapidly pull together information on pre- and post-fire conditions. For example, knowing where to apply mulch after a fire can reduce runoff and erosion and can help minimize downstream risks from fire induced land cover and soil changes. AGWA has already been successfully used for post-fire BAER team watershed assessments following fires in Arizona, New Mexico, California, Idaho and Washington.  AGWA was jointly developed by scientists with the USDA Agricultural Research Service (ARS) Southwest Watershed Research Center in Tucson, AZ, the U.S. Environmental Protection Agency (EPA), and the Universities of Arizona and Wyoming. ARS researchers and their partners originally developed the computer model as a multipurpose computer system and software tool designed for managing and analyzing water quantity and quality to help keep our Nation’s watersheds cleaner. AGWA uses nationally available sources to rapidly establish and execute results from two ARS-developed watershed models, the Kinematic Runoff and Erosion Model (KINEROS2) and the Soil and Water Assessment Tool (SWAT).  It enables the user to visualize and compare model results to understand the impact of a certain practice on a given landscape. How we manage activities that take place on crop production areas, rangelands, pastures, forests, meadows, and urban areas influences the quantity and quality of water available for domestic, industrial, agricultural and ecological uses. You can learn more about AGWA at www.tucson.ars.ag.gov/agwa.  Category/Topic:  Research and Science  Tags:  Arizona  ARS  California  EPA  FS  Idaho  New Mexico  Science Tuesday  University of Arizona  Washington State  watersheds  wildfires  Wyoming","What are the potential impacts on crop production areas from post-fire land cover and soil changes, as identified by the Automated Geospatial Watershed Assessment (AGWA) tool?","the potential impact on crop production areas from post-fire land cover and soil changes, as identified by the AGWA tool, is ""downstream risks"" that can be minimized by applying mulch after a fire."
"Serving Savory Seafood for Holiday Meals  According to the National Oceanic and Atmospheric Administration, the United States is the second largest consumer of seafood in the world after China. With several holidays around the corner, many of us are preparing for small celebrations at home.  Peggy R. Biga, PhD, AAAS Science & Technology Policy Fellow, USDA Office of the Chief Scientist and Caird Rexroad, National Program Leader for Aquaculture, Agricultural Research Service  Posted in  Research and Science  Nov 27,   Respond to this story",What is the primary industry related to seafood consumption and aquaculture?,Agriculture.
"Historic Investment Will Support Entire Local Food Supply Chain  Release & Contact Info  Press Release  Release No. .14  Contact:Office of Communications 720-  WASHINGTON, May 8, – Agriculture Secretary Tom Vilsack today announced that USDA is making a historic $78 million investment in local and regional food systems, including food hubs, farmers markets, aggregation and processing facilities, distribution services, and other local food business enterprises.""The Farm Bill has given USDA new tools, resources and authority to support the rural economy,"" Vilsack said. ""Consumer demand for locally-produced food is strong and growing, and farmers and ranchers are positioning their businesses to meet that demand. As this sector continues to mature, we see aggregation, processing, and distribution enterprises across the local food supply chain growing rapidly. These historic USDA investments in support of local food give farmers and ranchers more market opportunities, provide consumers with more choices, and create jobs in both rural and urban communities.""Vilsack said that $48 million in loan guarantees for local food projects is now available through USDA 's Rural Development's Business and Industry Guaranteed Loan Program, and $30 million is available through competitive grants via the Agricultural Marketing Service's (AMS) Farmers Market and Local Foods Promotion Program.The Farm Bill requires USDA to set aside at least five percent of Business and Industry (B&I) program loan guarantees for projects that focus on local food business enterprises. Details on how to apply for local food funding through the B&I program are available on the Rural Development website. Applications are accepted on a rolling basis. The B&I program has the authority to fund local food infrastructure in urban areas as long as the project supports farm and ranch income and expands healthy food access in underserved communities.Rural Development's B&I program provides financial backing for rural business development in partnership with private-sector lenders. It is one of several USDA programs that help finance local foods projects. In , Rural Development supported more than 170 local food infrastructure projects – from food hubs, to scale-appropriate processing facilities, to cold storage and distribution networks. Entities eligible for B&I loan guarantees include cooperatives, non-profit organizations, corporations, partnerships or other legal entities, Indian tribes, public bodies or individuals.The Farm Bill tripled funding for marketing and promotion support for local food enterprises by creating the Farmers Market and Local Foods Promotion Program, administered by the Agricultural Marketing Service (AMS). This new program makes $30 million available annually to farmers markets, other direct producer-to-consumer venues, and other businesses in the local food supply chain. Under this program, $15 million is now available for marketing and promotional support specifically for local food businesses, including food hubs, delivery and aggregation businesses, and processing and storage facilities along the local food supply chain, while $15 million is for marketing support for farmers markets and other direct to consumer outlets. Since , AMS, which administers this program, has funded nearly 450 projects totaling $27 million to support direct marketing efforts for local food. More information about how to apply is available on the AMS website. Applications are due June 20, .These funding opportunities are cornerstones of the USDA's commitment to support local and regional food systems. USDA's Know Your Farmer, Know Your Food Initiative coordinates the Department's policy, resources, and outreach efforts related to local and regional food systems The Know Your Farmer, Know Your Food Compass maps nearly 3,000 local and regional food projects supported by USDA and eleven other federal agencies. Secretary Vilsack has identified strengthening local food systems as one of the four pillars of USDA's commitment to rural economic development, along with production agriculture (including expanding export markets and improving research), promoting conservation and outdoor recreation opportunities, and growing the biobased economy. is an equal opportunity provider and employer. To file a complaint of discrimination, write: USDA, Office of the Assistant Secretary for Civil Rights, Office of Adjudication, Independence Ave., SW, Washington, DC 0- or call 632- (Toll-free Customer Service), 877- (Local or Federal relay), 377- (Relay voice users).","What are the main funding opportunities provided by USDA's Rural Development and Agricultural Marketing Service programs for supporting local food systems, including farmers markets, aggregation and processing facilities, and other local food business enterprises?","1. **Loan guarantees through the Business and Industry (B&I) program**: $48 million available to support local food projects, with at least 5% set aside for projects that focus on local food business enterprises. 2. **Competitive grants via the Farmers Market and Local Foods Promotion Program**: $30 million available annually to farmers markets, other direct producer-to-consumer venues, and other businesses in the local food supply chain, including marketing and promotional support specifically for local food businesses."
"International Day of Rural Women Spotlight: Indiana Soccer Moms Score Big as Global Entrepreneurs with USDA Assist  For a women-owned business in rural Indiana, working with USDA’s Foreign Agricultural Service (FAS) became a life-changing experience. Soccer moms Carol Podolak and Joy Thompkins sold homemade peanut butter as their kids’ team fundraiser to travel from Portage, Indiana to Dallas, Texas for a tournament in . Customers wanted the pretzel, blueberry, and toffee peanut butter more than once a year, so Podolak and Thompkins started taking custom orders. And now, BNutty is on shelves in stores around the world.  Zane Evans, Public Affairs Specialist, USDA Foreign Agricultural Service  Posted in  Trade  Rural  Oct 13,   Respond to this story","How did Carol Podolak and Joy Thompkins, two Indiana soccer moms, leverage their homemade peanut butter business into a global entrepreneurial success with assistance from USDA?","Carol Podolak and Joy Thompkins leveraged their homemade peanut butter business into a global entrepreneurial success by taking custom orders and receiving assistance from the USDA's Foreign Agricultural Service (FAS), which helped them expand their product to shelves in stores around the world."
"USDA Mississippi Public Information Coordinator in  Rural  Jan 25,   Earlier this month, all Mississippi agencies and staff were invited to participate in USDA’s Martin Luther King Jr. National Day of Service by volunteering two hours of their time to a non-profit organization of their choice. Three USDA Rural Development Mississippi State Office employees, Jennifer Jimerson, Ericka Butler, and Michelle Wilkerson volunteered at Stewpot Community Services in Jackson, serving meals for lunch. The very heart of Stewpot is the noon meal its staff and volunteers serve each day of the year. This meal serves as the center of each day as well as the heart of the Stewpot philosophy. Rich and poor, black and white … all God's children come together over a nourishing meal. More than 120 people a day are physically and spiritually fed in the community kitchen and 50 meals are delivered to shut-ins in the area. Volunteers are always needed to lend a hand in the Stewpot Community Kitchen. USDA Rural Development employees began volunteering at Stewpot Community Services during USDA’s Martin Luther King, Jr. National Day of Service. “After volunteering in , staff has continued to support the organization by volunteering throughout the year. USDA Rural Development works each day to help rural communities, so we want to support organizations that offer assistance in their communities and who strive to help those in need,” said State Director for USDA Rural Development Mississippi, Trina George. Anyone is welcome to eat the Stewpot noon meal. Over 60,000 meals are served each year, and more than 7,000 volunteers serve in the community kitchen each year. Volunteers work as a team to make the plates for the Meals on Wheels program as well as the plates for everyone in the dining room. Volunteers serve the plates and drinks to everyone who has come to Stewpot for the noon meal. Approximately 10 volunteers are needed each day of the week to keep this rewarding ministry going. Stewpot, which began as simple soup kitchen, has developed into an organization offering several different programs – from shelter, to clothing, to counseling, to children’s programs. To learn more about how you can help serve residents of your community click here. Ericka Butler, Michelle Wilkerson, and Jennifer Jimerson. USDA Rural Development staff volunteered at Stewpot Community Services on USDA’s Martin Luther King Jr. National Day of Service.  Category/Topic:  Rural  Tags:  Day of Service  Jackson  Mississippi  MLK Day  Rural Development","What USDA Mississippi employee group volunteered at Stewpot Community Services, serving meals for lunch and continued to support the organization throughout the year?","Three USDA Rural Development Mississippi State Office employees, Jennifer Jimerson, Ericka Butler, and Michelle Wilkerson, volunteered at Stewpot Community Services."
"Recruiting the Next Generation of Food Safety Workers  Food Safety and Inspection Service Administrator Al Almanza today spoke about career opportunities at Texas A&M Kingsville to the Hispanic Leaders in Agriculture and the Environment. HLAE is a USDA-supported organization that draws membership from several colleges and universities.  acampbell  Posted in  Health and Safety  Apr 12,   1 Response",What career opportunities were highlighted by Food Safety and Inspection Service Administrator Al Almanza to Hispanic Leaders in Agriculture and the Environment at Texas A&M Kingsville?,Career opportunities in food safety.
"Office of Communication, U.S. Forest Service in  Forestry  May 12,  Warm Fire, . Over the last three decades, fire season lengths have increased by 60-80 days and annual acreages burned have more than doubled to over 7 million acres annually. In addition, growing housing development in forests has put more people and houses in harms’ way, also making firefighting efforts more expensive. Photo credit: U.S. Forest Service, Southwestern Region, Kaibab National Forest. Forests significantly contribute to our quality of life, but climate change is adversely affecting natural resources in rural and urban areas across the U.S. A new report released by the White House, the National Climate Assessment, explores many related issues including how a warming planet affects our forests. With contributions from U.S. Forest Service scientists, the report is one of the most comprehensive examinations of climate change and its effects on forested land. It concludes that a warming climate will complicate future management of public, private and tribal forests. “Climate change is currently triggering multiple, sometimes contrasting, responses from our forests,” said Dave Cleaves, U.S. Forest Service Climate Change Advisor. “Longer growing seasons and gradually warming temperatures are helping trees grow faster in some areas, but in other areas, these longer and warmer growing seasons increase late summer moisture stress and reduce tree growth.” The Forest Service integrates climate change awareness, mitigation and adaptation into the management of its 193 million acres through the Climate Change Performance Scorecard.  For example, this tool has encouraged national forests to identify vulnerable water resources, plant more climate-resilient tree species, research carbon storage capacity and more. Some of the other ways the Forest Service manages wildlands includes reducing the potential for large crown fires expected in a warmer climate by removing hazardous fuels and managing for lower stem densities in dry forests, managing forest genetic diversity to increase resilience to a warmer climate and restoring riparian areas adjacent to streams to ensure cold-water fish habitat during summer low-flow periods. Public and private forests in the U.S. will increasingly be vulnerable to ecosystem changes and tree mortality through fire, insect infestations, drought and disease outbreaks. At the same time, the need for healthy forests will only continue to increase. Forests provide an expanding opportunity to support emerging bioenergy markets and carbon credit systems. It is likely such uses will interact with the demand for wood products, healthy watersheds and recreational opportunities. There will also be continued economic pressures encouraging a shift from forestland to agricultural or urban land uses. According to Linda Joyce, a Forest Service scientist, and one of the authors of the report, climate-smart management practices are being developed and implemented, and the agency is maintaining its focus on retaining forests as forests restoring forest health and resilience, and reforesting private and federal lands. However, Joyce emphasized that implementation of climate-smart management practices can be increased only through effective integration of scientific information in management of our national wildlands.  Category/Topic:  Forestry  Tags:  Climate Change  Dave Cleaves  Forestry  Forests  FS  Linda Joyce  National Climate Assessment  White House","What strategies can be employed by the U.S. Forest Service and private landowners to maintain forest health and resilience in a warming climate, while also supporting emerging bioenergy markets and carbon credit systems?","1. Removing hazardous fuels and managing for lower stem densities in dry forests to reduce the potential for large crown fires. 2. Planting more climate-resilient tree species and restoring riparian areas adjacent to streams to ensure cold-water fish habitat during summer low-flow periods. 3. Managing forest genetic diversity to increase resilience to a warmer climate. 4. Integrating climate change awareness, mitigation, and adaptation into forest management through tools like the Climate Change Performance Scorecard. Private landowners can also adopt these strategies, as well as others such as: 1. Developing and implementing climate-smart management practices. 2. Creating carbon credit systems that support reforestation and afforestation efforts. 3. Partnering with government agencies to access funding and expertise for forest conservation and restoration projects. 4. Investing in research and development of new technologies that can help mitigate the impacts of climate change on forests. By implementing these strategies, both the U.S. Forest Service and private landowners can work together to maintain forest health and resilience while also supporting emerging bioenergy markets and carbon credit systems."
"A collaborative agreement for use of NOAA satellites will help the Interior and Agriculture Departments detect wildfires early, track wildfires in real time, and provide for public safety and air quality modeling  Release & Contact Info  Press Release  Release No. .24  Contact: USDA Press Email: press@usda.gov  WASHINGTON, July 23, — The Biden-Harris administration today announced it is taking additional steps to safeguard western communities in the face of increasingly dangerous and intense wildland fires by building advanced wildfire detection capabilities using satellite technology. The Department of the Interior and U.S. Department of Agriculture (USDA)’s Forest Service have signed an agreement with the Department of Commerce’s National Oceanic and Atmospheric Administration (NOAA) to use the NOAA Geostationary Operational Environmental Satellite — R series (GOES-R) to rapidly detect and report wildfire starts. Supported by a $20 million investment from the President’s Bipartisan Infrastructure Law—$10 million each from Interior and Agriculture— this new agreement will use advanced remote sensing capabilities to improve the speed and accuracy of wildfire detection. President Biden’s Investing in America agenda, through the Bipartisan Infrastructure Law, is bringing much-needed assistance to communities across the country — deploying innovative tools to tackle wildfires, increasing the resilience of lands facing the threat of wildland fires, and better supporting federal wildland firefighters. The law includes $5 billion for these Departments over five years to invest in preparedness, fuels management, post-fire restoration, and fire science. “This partnership is one of the many ways we are investing in technology to improve firefighter and community safety,” said Secretary of Agriculture Tom Vilsack. “Wildland firefighting will always require highly skilled individuals working on the ground, but with more real-time information we can reduce the risks to crews and pilots, and improve our response time, reducing the risk to impacted communities.” “This collaborative effort demonstrates how the federal government is deploying resources from President Biden’s historic Investing in America agenda to improve its emergency response capabilities and address increasingly frequent and extreme climate-driven wildfires,” said Secretary of the Interior Deb Haaland. “By using expanded satellite capacity to pinpoint wildfire ignitions and provide real-time for wildfire managers, this partnership with NOAA will enable the Interior and Agriculture Departments to respond to wildfires more rapidly and make informed decisions for firefighting operations and public safety.” “Now more than ever, the impacts of climate change are increasing the threat of wildfires across the country and thanks to President Biden’s commitment to investing in America, NOAA has been able to significantly improve fire weather forecasts to keep communities safe,” said Secretary of Commerce Gina Raimondo. “This new partnership, a result of the most ambitious climate agenda in history, will help expand our ability to detect wildfires, improve response times, and keep families in western communities out of harm’s way.” Use of NOAA’s GOES-R satellite will enable the Interior and Agriculture Departments to detect wildfires early, provide firefighters a more detailed look at wildfire conditions, allow faster hot spot detection, and provide the ability to track wildfire progression in real time. GOES-R series satellites are frequently capable of detecting wildfires before they are spotted on the ground or reported to 911. The satellites can also be used to pinpoint the exact location of a fire after smoke occur. These improved capabilities will support interagency efforts to protect people and communities from increasingly devastating wildfires. GOES-R satellite observations are not only valuable for detecting wildfires but are also critical for observing and monitoring smoke from those fires. The ability to monitor smoke plumes in near real time is particularly useful in directing firefighting efforts from the air. Deploying airplanes and helicopters for wildfire suppression efforts is often hampered by poor visibility. GOES-R satellites can help guide decisions for deploying flights by providing information on the exact location and drift of smoke from a fire. The smoke detection and monitoring information also enable better air quality forecasts to help safeguard public health. These improvements help equip communities with the information they need to assess risks and develop climate solutions—a key objective of the National Climate Resilience Framework. Today’s effort supports recommendations by the Wildland Fire Mitigation and Management Commission, which was established through the Bipartisan Infrastructure Law and charged with making recommendations to improve federal policies related to the mitigation, suppression, and management of wildland fires in the United States. In September , the Commission released a comprehensive report (, 5.3 ) to Congress outlining 148 recommendations to improve the nation’s relationship with wildfire. This collaboration advances recommendations for expanded use of wildfire detection systems and improved collaboration across organizations and jurisdictions. # USDA is an equal opportunity provider, employer, and lender.","What advanced satellite technology will be used by the Interior and Agriculture Departments in partnership with NOAA to detect wildfires early, track their progression in real-time, and provide critical information for public safety and air quality modeling?","The NOAA Geostationary Operational Environmental Satellite — R series (GOES-R) will be used by the Interior and Agriculture Departments in partnership with NOAA to detect wildfires early, track their progression in real-time, and provide critical information for public safety and air quality modeling."
"Officials View Producer Efforts to Improve Quality of Chesapeake Bay  “As of , an estimated 18,091,710 people lived in the Chesapeake Bay watershed, up from 17,986,898 in . Experts predict the watershed’s population will surpass 20 million by and reach 21.4 million by . Each of the 18.1 million people that live in the region affects the Bay: consuming resources, altering the landscape and polluting the air and water.” -- Chesapeake Bay Program  Skip Hyberg, Senior Economist, USDA Farm Service Agency  Posted in  Conservation  Mar 22,   1 Response",What is predicted to be the population of the Chesapeake Bay watershed by ?,20 million.
