content,question,answer
"Changing Climate Is Affecting Agriculture in the U.S. The changing climate presents real threats to U.S. agricultural production, forest resources, and rural economies. These threats have significant implications not just for farmers, ranchers, and forest landowners, but for all Americans. Land managers across the country are already feeling the pressures of a changing climate and its effects on weather. As these risks continue and amplify, producers will be faced with the challenges of adapting. Some of these risks are:  More severe storms - NOAA reported that was the second most intense year in our history for extreme weather events.  Rising average temperatures - Higher temperatures mean increases in invasive species and costs for weed and pest control.  Extremes in precipitation - In the Northeast, heavier, more intense rains threaten to reduce yields. In the Southwest, increased drought poses a challenge to nut, fruit and vegetable producers.  More forest fires - The fire season is 60 days longer than it was 30 years ago. A recent Forest Service study predicts that the number of acres susceptible to fires could double by . Preparing for Increased Weather Risks Regional Climate Hubs In an effort to mitigate climate-related risks, USDA has established seven regional hubs for risk adaptation and mitigation to climate change. These Hubs will deliver science-based knowledge and practical information to farmers, ranchers and forest landowners on a regional basis to support decision-making related to changing climate. The Hubs will provide:  Technical support for land managers to respond to drought, heat stress, floods, pests, and changes in the growing season.  Assessments and regional forecasts for hazard and adaptation planning to provide more time to prepare.  Outreach and education for farmers, ranchers and forest landowners on ways to mitigate risks and thrive despite change. For more information on the Hubs, visit the USDA Climate Hubs Webpage. Climate Solutions at USDA USDA is taking steps to create modern solutions to the challenge of climate change. New uniform, science-based guidance on cover crop management helps producers prevent erosion, improve soil properties, supply nutrients to crops, suppress weeds, improve soil water content, and break pest cycles. The following two assessments project climate impacts over the coming years:  Climate Change and Agriculture in the United States: Effects and Adaptation  Effects of Climatic Variability and Change on Forest Ecosystems: A Comprehensive Science Synthesis for the U.S. Forest Sector USDA also released a Carbon Management Evaluation Tool (COMET-FARM) to help producers calculate how much carbon their land's soil and vegetation can remove from the atmosphere. FACT SHEET: Biogas Opportunities Roadmap: Voluntary Actions to Reduce Methane Emissions, Increase Energy Independence and Grow the Economy (August 1, )","What are some proactive measures that USDA has taken to help farmers, ranchers, and forest landowners prepare for and mitigate the impacts of climate change, such as establishing Regional Climate Hubs and developing tools like COMET-FARM?","USDA has established Regional Climate Hubs to provide science-based knowledge and practical information to farmers, ranchers, and forest landowners on a regional basis to support decision-making related to changing climate. Additionally, USDA has developed tools such as COMET-FARM, a Carbon Management Evaluation Tool, to help producers calculate how much carbon their land's soil and vegetation can remove from the atmosphere."
"AMS Deputy Administrator, Livestock and Seed Program in  Food and Nutrition  Oct 28,  USDA is as American as baseball and apple pie. Almost anything and everything about U.S. food – and in some respects, baseball – is somehow connected to USDA. Curious? Read on to see how USDA ties in to the World Series. “The Ryan Express” Delivers the Goods Major League Baseball Hall of Famer Nolan Ryan pitched 27 years in the big leagues, tossing a league record seven no-hitters. In that span Ryan was comfortably pumping 100 mile-per-hour fastballs past hitters until he was 40 years old, registering 95 mph on the radar gun until retirement. Nicknamed “The Ryan Express” for his baseball exploits, he went on to become a successful business owner. Ryan knows a good deal when he sees one. In he became a principal owner, president and CEO of the Texas Rangers baseball club. The team has made it to the World Series the last two seasons: losing to the San Francisco Giants in and participating in the thrilling, nail-biting autumn classic of against the St. Louis Cardinals. Ryan also knows the value of the USDA shield. He’s the head of the Nolan Ryan Guaranteed Tender Beef Program, a marketing program verified by USDA’s Agricultural Marketing Service (AMS). AMS relies on university-researched and industry-recognized standards to determine which marketing claims it chooses to verify. Companies like Ryan’s can approach AMS and request the agency verify marketing claims such as “guaranteed tender” to assure customers that the products listed on packaging are exactly what they claim.  This is an important service to consumers who desire a certain quality of beef and want third-party assurance that their beef purchases meet exacting requirements. _________________________________________________________________________________________ USDA Certified – St. Louis (Cardinals) Style If you bellied-up at a local sports bar and ordered a plate of St. Louis Style ribs while watching the World Series, thank a former USDA employee for naming the cut of pork. In the late s Steve Olson, an agricultural marketing specialist in the USDA Livestock and Seed Program’s Standardization Division, wrote meat standards for the Agricultural Marketing Service’s Institutional Meat Purchase Specifications (IMPS). Last June Olson shared his story about naming the cut of meat with the St. Louis Post-Dispatch. He explained how some butchers fancied carving off the breast bone and brisket bones from pork spareribs. “We did a survey to find out if there was a consensus for what this was called,” Olson told the Post-Dispatch. A majority of the respondents called it a St. Louis cut. “The only reason I went ahead and put the term into the IMPS is because I happen to be an avid St. Louis Cardinals baseball team fan, and they had just defeated the San Francisco Giants in a playoff,” Olson said. For more specifications, you can view the latest IMPS report. On pages 11 and 32, Item No. 416A is listed as “Pork Spareribs, St. Louis Style.” St. Louis ribs, ready to eat. This popular cut of pork was named by Steve Olson, a Cardinals baseball fan and USDA employee. Photo by Ernesto Andrade.  Category/Topic:  Food and Nutrition  Tags:  AMS  IMPS  Livestock and Seed Program  Nolan Ryan","What service provided by USDA's Agricultural Marketing Service (AMS) allows companies like Nolan Ryan's Guaranteed Tender Beef Program to request verification of marketing claims, such as ""guaranteed tender"", to assure customers that their products meet exacting requirements?",The service provided by USDA's Agricultural Marketing Service (AMS) is called verification of marketing claims.
"AMS Fruit and Vegetable Program Deputy Administrator and Dave Tuckwiller, AMS Commodity Procurement Program Director in  Food and Nutrition  Sep 11,  “We create opportunities for American ag businesses,” said Casey Wong-Buehler, AMS Commodity Procurement Program Specialist. “Trips like this help us ensure that our procurement requirements provide a realistic framework for our vendors to successfully supply quality food.” Across the country, schools are back in session. Here at the USDA’s Agricultural Marketing Service (AMS), our inspectors and procurement specialists work hard to make sure that quality, domestically-produced foods are delivered to students and other recipients for our federal food purchasing programs. As students are getting used to their new schedules, we would like to highlight how our own little field trip shed some light on a typical day for some of our employees. A team of AMS employees recently traveled to Knouse Foods, a grower-owned cooperative that supplies apple and cranberry products for federal food purchasing programs. The employees saw first-hand how USDA inspectors help Knouse and other companies verify the quality of their products. As the apple sauce traveled through the facility, USDA inspectors pulled random samples to make sure that they met product quality and condition requirements. All USDA Foods are to be inspected, and in this case, inspectors pulled samples of apple sauce to evaluate traits like its color, flavor, and consistency. As an independent third-party, the inspections help suppliers meet USDA Foods requirements but they also can help them meet requirements from other buyers. The tour also covered another important part of the procurement process – the delivery. In addition to the food inspection requirement, all contracts for federal food purchasing programs require delivery trucks to be inspected. The team got a chance to see this process, called check-loading. USDA inspectors checked the condition of the trailers, making sure that the trailer is clean, doesn’t contain any holes, and has updated inspection codes.  For the Commodity Procurement Program specialists, the trip gave them a chance to see how some of the contract provisions are carried out by both the suppliers and USDA inspectors. Whether it’s telling them about the procurement process or product specifications and requirements, the procurement specialists are always in constant contact with their vendors. The recent trip helped the specialists see how the vendors incorporate inspections and check-loading into their business plans. They saw how long it takes for trucks to be inspected and the impact it has on their deliveries. All of us here at AMS are proud to play a role in supporting American ag businesses by ensuring that they can provide quality, wholesome foods to our students and other federal food purchase program recipients. We wish all of our students a successful school year. We encourage businesses to learn more about how our Specialty Crops Inspection Division and our Commodity Procurement Program can support their business. “Ensuring the product quality of our USDA Foods is extremely important,” said USDA Specialty Crops Inspection (SCI) Division employee Michael Harutinian. “Our employees pull random samples, helping our suppliers increase their confidence in the quality of their products,” said Harutinian.   Category/Topic:  Food and Nutrition  Tags:  AMS  Back to School  Commodity Procurement Program  Inspections  Knouse Foods  procurement  quality  SCI  Specialty Crops Inspection Division  USDA Foods",What is the process by which USDA inspectors ensure the quality of cranberry products supplied for federal food purchasing programs?,"The USDA inspectors pull random samples of cranberry products to evaluate traits such as color, flavor, and consistency."
"USDA Hosts Kids’ Day Event for Washington, DC-Area Families to Kick-Off National Invasive Species Awareness Week  From a very humble start, National Invasive Species Awareness Week’s Kids’ Day has bloomed into an event featuring an invasive species magician, a 13-year old ‘invasive species hunter’ from Texas, and even Woodsy Owl from the Forest Service. The event, sponsored by USDA’s Animal and Plant Health Inspection Service, will take place on February 26 at the U.S. Botanic Garden in Washington, D.C.—a perfect setting to educate kids about the importance of protecting our forests, agriculture and the environment from harmful invasive species.  Kelsey Branch, Biologist, USDA-APHIS  Posted in  Animals  Plants  Feb 22,   2 Responses",What are some ways that agricultural experts like those at USDA-APHIS educate kids about protecting forests and the environment from invasive species?,"The USDA-APHIS educates kids about protecting forests and the environment from invasive species through events such as National Invasive Species Awareness Week's Kids' Day, which features a magician, an ""invasive species hunter"", and Woodsy Owl to teach children about the importance of protecting our forests, agriculture and the environment from harmful invasive species."
"Public Affairs Specialist, Food Safety and Inspection Service in  Health and Safety  Jun 07,   Dr. Joanna Zablotsky Kufel discovered community and public health at Tufts University in Massachusetts. Afterwards, she worked in public health for a couple of years and then moved to Baltimore, Md., where she earned her Masters in and Ph.D. in at the Johns Hopkins Bloomberg School of Public Health. “After learning all about food safety at the state and local level, I still wanted to learn more about food safety at the federal level, where you can influence food safety throughout the entire food chain,” said Dr. Zablotsky Kufel. Dr. Zablotsky Kufel began her career with USDA as a summer intern working for the Food Safety Inspection Service (FSIS). Today she works as a Public Health Food Safety Analyst with FSIS, analyzing from across FSIS gathered by inspectors in the field, and partner agencies to evaluate FSIS policies and performance. The analyses performed and produced allow FSIS to effectively use science and to understand foodborne illness and emerging trends, respond to those risks and ensure that food safety inspection aligns with decreasing those risks. Dr. Zablotsky Kufel and her colleagues developed the “All Illness Measure”, a key measure of FSIS’ performance that helps assess whether the work that FSIS employees perform is having an effect on how often people get sick from food that FSIS regulates. “We use a public health approach that involves Assurance – Measurement – Refinement to ensure the food supply is safe,” she explained. “FSIS Inspection Program Personnel work to make sure that regulated product is safe and produced in accordance with FSIS policies (Assurance). We then measure FSIS’ impact on the public's health and determine whether our policies and activities are having a positive effect (Performance Measurement). This allows FSIS to evaluate existing policy methodologies and create new and innovative approaches to further prevent foodborne illness (Policy Development/Refinement).” The cycle, incorporated in FSIS’ - Strategic Plan, creates a feedback loop that helps FSIS modernize and better address existing and emerging food safety threats. Dr. Zablotsky Kufel also works with CDC and FDA analysts on the Interagency Food Safety Analytics Collaboration to determine what foods cause human illness. “In the next 5 years, I see CDC, FDA and FSIS working together even more closely to prevent illness and having a more real-time understanding of what causes illness—with the ability to react much more rapidly to emerging trends,” Dr. Zablotsky Kufel explained. “I really enjoy working with some of the best minds in public health and food safety to figure out how best to use the we have, identify new sources of , understand why people get sick and learn how we can prevent outbreaks in the future.” Faces of Food Safety is an initiative by FSIS to introduce Americans to the real people who work every day to keep the food in their own homes and yours safe. Click to read more about Dr. Zoblotsky Kufel and other Faces of Food Safety on FSIS’s website.  Category/Topic:  Health and Safety  Tags:  Dr. Joanna Zablotsky Kufel  Faces of Food Safety  Food Safety  FSIS","What is the primary goal of the Interagency Food Safety Analytics Collaboration between FSIS, CDC, and FDA analysts?","The primary goal of the Interagency Food Safety Analytics Collaboration between FSIS, CDC, and FDA analysts is to determine what foods cause human illness."
"Farm Service Agency Disaster Assistance Available for Producers Affected by Flooding, Fire and Tornadoes   The Farm Service Agency is reminding crop and livestock producers throughout states that have recently experienced severe damage from flooding, wildfires and tornadoes that FSA programs may be available to assist with recovery. According to Acting FSA Administrator Val Dolcini, whether it’s wildfires in the Southwest, flooding or tornados in the Midwest, Plains, and Southeast, learning about our FSA disaster programs is an important first step for producers in the recovery process.  Tanya Brown, USDA Farm Service Agency  Posted in  Health and Safety  Animals  Plants  Apr 28,   2 Responses","What FSA disaster programs are available to assist crop and livestock producers affected by severe damage from wildfires, flooding, and tornadoes?","The Farm Service Agency (FSA) offers disaster assistance programs for crop and livestock producers affected by severe damage from wildfires, flooding, and tornadoes."
"Natural Resources Conservation Service in  Conservation  Apr 17,  A Conservation Innovation Grant recipient accepts award from the U.S. Water Alliance. Photo courtesy NRCS. When USDA’s Natural Resources Conservation Service (NRCS) awarded a Conservation Innovation Grant to the Electric Power Research Institute (EPRI) in , the notion of administering the nation’s largest water quality trading program in the Ohio River Basin was a twinkle in the eye of EPRI scientist Jessica Fox. Fast forward to —the multi-state water-trading program is a reality, and the Institute was one of three entities to be awarded this year’s Water Prize by the U.S. Water Alliance. Through Conservation Innovation Grants, NRCS funds projects that develop innovative approaches and technologies for natural resource conservation on agricultural lands. These grants have funded more than 60 environmental markets projects, including a number of the nation’s leading market efforts. EPRI’s program, launched when the states of Ohio, Kentucky and Indiana signed a multi-state compact in , works with agricultural producers who voluntarily implement conservation practices that reduce nutrient runoff into local waters. Through the program’s first trades in March , three energy companies purchased these credits and retired them for associated nutrient and ecosystem benefits. On April 13, In front of a crowded auditorium at the National Geographic Society in Washington, DC, Former EPA Deputy Administrator Bob Perciasepe awarded the prize to Fox who accepted on behalf of EPRI. Perciasepe expressed admiration for EPRI’s ability to innovate and engage stakeholders from Duke Energy to the Ohio Farm Bureau, and everyone in between. In her award acceptance remarks, Fox noted that part of the project’s success is that EPRI was never satisfied with developing the nation’s largest water quality trading program, or executing the first trades. “We are always pushing and striving, looking forward to the next chapter.” The next chapter for the Institute begins on May 20 when it holds a public auction for nutrient credits in New York City. These credits were generated through the installation of cover crops, livestock fencing and other conservation practices on 30 farms last summer. Click here for a video of Fox describing the project and what it means to win the U.S. Water Prize. Find out more about NRCS Conservation Innovation Grants.  Category/Topic:  Conservation  Tags:  Bob Perciasepe  Conservation  Conservation Innovation Grants  EPA  Indiana  Kentucky  NRCS  Ohio  Washington DC  water quality",What innovation approach and technology did EPRI develop with funding from NRCS' Conservation Innovation Grants that resulted in the Institute winning the U.S. Water Prize?,"EPRI developed a multi-state water-trading program, which works with agricultural producers who voluntarily implement conservation practices that reduce nutrient runoff into local waters, allowing energy companies to purchase and retire these credits for associated nutrient and ecosystem benefits."
"We Will Never Forget Our Fallen Firefighters  Few would ever take jobs that require one to literally run toward fire—and possible death—but that’s exactly what countless firefighters did last year. Seventy-three of those heroes didn’t live to tell about it. Their deaths happened on U.S. Forest Service-managed lands, in public and privately-owned buildings and just about any place fire can burn. These fallen firefighters were remembered during a tribute held at the National Fire Academy in Emmitsburg, Md. Oct.6. The National Firefighters Foundation has sponsored this national event every October since to honor all firefighters who died in the line of duty the previous year.  Robert Westover, Office of Communication, U.S. Forest Service  Posted in  Forestry  Oct 23,   2 Responses",What national event honors fallen firefighters who have lost their lives in the line of duty?,The National Firefighters Foundation sponsors a national event every October to honor all firefighters who died in the line of duty the previous year.
"A Love of the Outdoors Inspires a Forest Service Employee to Support Her Natural Resource Mission  Jennifer Heisey Barnhart has always loved the outdoors so it’s only logical that all of her jobs have been working outdoors. Jennifer is a fairly new employee of the U.S. Forest Service, currently working with the Andrew Pickens Ranger District on the Sumter National Forest in South Carolina for almost four years, but her experience as a natural resources specialist is many years strong. “From a very young age, I’ve always found ways to have fun outdoors and learn about my natural resources,” Barnhart said. She has held jobs as a backcountry caretaker, trail maintenance, and recreation planner.  Beverly Carroll, Office of Communications, U.S. Forest Service  Posted in  Forestry  Aug 15,   5 Responses",What is the primary responsibility of a backcountry caretaker in a national forest?,These are general responsibilities and may not be specific to the U.S. Forest Service or national forests.
"Developing National Dietary Guidance for the Birth to 24 Months Age Group  Good nutrition is vital to optimal infant and toddler growth, development, and health. The importance of this age group has been emphasized by First Lady Michelle Obama, who said that “If our kids get into the habit of getting up and playing, if their palates warm up to veggies at an early age, and if they’re not glued to a TV screen all day, they’re on their way to healthy habits for life.” So, making sure that even the youngest infants and toddlers are on the road to a healthy life is critical, and having national dietary guidance for infants and children from birth to 24 months can help make this happen. The Dietary for Americans (DGA) provides sound advice for making food and physical activity choices that promote good health and a healthy weight, and help prevent disease for Americans, including Americans at increased risk of chronic disease. The DGA has traditionally focused on adults and children 2 years of age and older. Infants and toddlers from birth to 24 months of age have not been a focus in previous versions of the DGA because of their unique nutritional needs, eating patterns, and developmental stages.  Colette I. Rihane, Director, Office of Nutrition Guidance and Analysis, Center for Nutrition Policy and Promotion  Posted in  Food and Nutrition  May 06,   1 Response",What specific nutritional needs and eating patterns are unique to infants and toddlers from birth to 24 months that were previously overlooked by the Dietary Guidelines for Americans?,The specific nutritional needs and eating patterns unique to infants and toddlers from birth to 24 months include their unique developmental stages.
"USDA Updates FoodKeeper App to Include New Food Items  The FoodKeeper app has received an update! The update adds 85 new food items to the FoodKeeper, including chorizo, prosciutto, edamame, fresh salsa, canned tuna, cereal bars, and salad dressings.  Meredith Carothers, Food Safety and Inspection Service, USDA  Posted in  Health and Safety  Oct 04,   1 Response",What new food items were recently added to the USDA's FoodKeeper app through an update?,"85 new food items were recently added to the USDA's FoodKeeper app, including chorizo, prosciutto, edamame, fresh salsa, canned tuna, cereal bars, and salad dressings."
"The Buried Forest of Alaska's Kruzof Island: a Window into the Past  Seldom does one find a way to directly date a prehistoric volcanic eruption, but 11-year-old Blake LaPerriere opened such a door for excited scientists in Southeast Alaska. Last September, Blake, his parents, and his younger brothers were exploring a beach on southwestern Kruzof Island, part of the Tongass National Forest landscape and just west of Sitka, Alaska, where they live. Blake investigated a deeply incised creek behind a pile of beach drift where he found a standing burnt tree embedded in a tall bank of pumice. He brought it to his family’s attention, asking “Do you think that’s from a volcanic eruption a long time ago?” Curious, Blake’s father Zach took photos and sent them my way.  James Baichtal, Tongass National Forest, U.S. Forest Service  Posted in  Forestry  Mar 07,   11 Responses",What unique discovery by 11-year-old Blake LaPerriere on southwestern Kruzof Island helped scientists directly date a prehistoric volcanic eruption?,"The unique discovery made by 11-year-old Blake LaPerriere was finding a standing burnt tree embedded in a tall bank of pumice, which provided a way for scientists to directly date a prehistoric volcanic eruption."
